4476741	k__Bacteria; p__Chloroflexi; c__Thermobacula; o__Thermobaculales; f__Thermobaculaceae; g__Thermobaculum; s__terrenum
672322	k__Bacteria; p__Spirochaetes; c__Brevinematae; o__Brevinematales; f__Brevinemataceae; g__Brevinema; s__andersonii
278595	k__Bacteria; p__Elusimicrobia; c__Elusimicrobia; o__Elusimicrobiales; f__Elusimicrobiaceae; g__Elusimicrobium; s__minutum
3623950	k__Bacteria; p__Dictyoglomi; c__Dictyoglomia; o__Dictyoglomales; f__Dictyoglomaceae; g__Dictyoglomus; s__turgidum
1875	k__Bacteria; p__Chrysiogenetes; c__Chrysiogenetes; o__Chrysiogenales; f__Chrysiogenaceae; g__Chrysiogenes; s__arsenatis
4348445	k__Bacteria; p__Chloroflexi; c__Ktedonobacteria; o__Ktedonobacterales; f__Ktedonobacteraceae; g__Ktedonobacter; s__racemifer
1277	k__Bacteria; p__Chloroflexi; c__Chloroflexi; o__Chloroflexales; f__Oscillochloridaceae; g__Oscillochloris; s__trichoides
2136916	k__Bacteria; p__Lentisphaerae; c__Lentisphaeria; o__Victivallales; f__Victivallaceae; g__Victivallis; s__vadensis
4444847	k__Archaea; p__Euryarchaeota; c__Methanococci; o__Methanococcales; f__Methanococcaceae; g__Methanothermococcus; s__okinawensis
4370637	k__Archaea; p__Crenarchaeota; c__Aigarchaeota; o__Caldiarchales; f__Caldiarchaceae; g__Caldiarchaeum; s__subterraneum
1137725	k__Bacteria; p__Spirochaetes; c__Brachyspirae; o__Brachyspirales; f__Brachyspiraceae; g__Exilispira; s__thermophila
239922	k__Archaea; p__Euryarchaeota; c__Methanopyri; o__Methanopyrales; f__Methanopyraceae; g__Methanopyrus; s__kandleri
64372	k__Archaea; p__Euryarchaeota; c__Methanopyri; o__Methanopyrales; f__Methanopyraceae; g__Methanopyrus; s__kandleri
547165	k__Bacteria; p__Chloroflexi; c__Chloroflexi; o__Chloroflexales; f__Oscillochloridaceae; g__Oscillochloris; s__trichoides
71731	k__Bacteria; p__Chloroflexi; c__Chloroflexi; o__Chloroflexales; f__Oscillochloridaceae; g__Oscillochloris; s__trichoides
125020	k__Archaea; p__Nanoarchaeota; c__Nanoarchaeoti; o__Nanoarchaeotales; f__Nanoarchaeotaceae; g__Nanoarchaeum; s__equitans Kin4-M
2834269	k__Bacteria; p__Acidobacteria; c__Holophagae; o__Holophagales; f__Holophagaceae; g__Holophaga; s__foetida
1131014	k__Bacteria; p__Actinobacteria; c__Nitriliruptoria; o__Nitriliruptorales; f__Nitriliruptoraceae; g__Nitriliruptor; s__alkaliphilus
1139988	k__Archaea; p__Euryarchaeota; c__Methanococci; o__Methanococcales; f__Methanococcaceae; g__Methanothermococcus; s__thermolithotrophicus
219691	k__Archaea; p__Euryarchaeota; c__Methanococci; o__Methanococcales; f__Methanococcaceae; g__Methanococcus; s__aeolicus
2918986	k__Bacteria; p__Chrysiogenetes; c__Chrysiogenetes; o__Chrysiogenales; f__Chrysiogenaceae; g__Desulfurispirillum; s__alkaliphilum
1105271	k__Bacteria; p__Actinobacteria; c__Thermoleophilia; o__Gaiellales; f__Gaiellaceae; g__Gaiella; s__occulta
3793	k__Bacteria; p__Spirochaetes; c__Brevinematae; o__Brevinematales; f__Brevinemataceae; g__Brevinema; s__andersonii